{
  "schemaVersion": 1,
  "id": "shackleton-rift",
  "title": "Разлом Шеклтона",
  "description": "Крупная зона перекрывает прямые подходы к двум центрам.",
  "tiledMap": "maps/shackleton-rift.tmj",
  "themeId": "realistic-dark",
  "balanceProfileId": "default",
  "seed": "shackleton-default-2026",
  "shiftDurationRealSeconds": 480,
  "centers": [
    {
      "id": "helios",
      "name": "Центр Гелиос",
      "oxygen": {
        "initial": 72,
        "capacity": 100,
        "depletionGameMinutes": 300
      },
      "food": {
        "initial": 66,
        "capacity": 100,
        "depletionGameMinutes": 420
      },
      "equipmentInitial": 65
    },
    {
      "id": "kepler",
      "name": "Центр Кеплер",
      "oxygen": {
        "initial": 58,
        "capacity": 100,
        "depletionGameMinutes": 240
      },
      "food": {
        "initial": 78,
        "capacity": 100,
        "depletionGameMinutes": 360
      },
      "equipmentInitial": 80
    },
    {
      "id": "aristarchus",
      "name": "Центр Аристарх",
      "oxygen": {
        "initial": 82,
        "capacity": 100,
        "depletionGameMinutes": 330
      },
      "food": {
        "initial": 54,
        "capacity": 100,
        "depletionGameMinutes": 300
      },
      "equipmentInitial": 55
    }
  ],
  "rovers": [
    {
      "id": "gagarin",
      "name": "Гагарин",
      "archetypeId": "standard",
      "spawnObjectId": "spawn-gagarin"
    },
    {
      "id": "tereshkova",
      "name": "Терешкова",
      "archetypeId": "fast",
      "spawnObjectId": "spawn-tereshkova"
    },
    {
      "id": "korolev",
      "name": "Королёв",
      "archetypeId": "repair",
      "spawnObjectId": "spawn-korolev"
    }
  ],
  "riskChoiceCenters": [
    "helios",
    "aristarchus"
  ]
}
